{
  "schemaVersion": 1,
  "id": "rain-cabin",
  "name": "雨夜木屋",
  "description": "雷雨夜里，点燃篝火的木屋。",
  "status": "starter",
  "tags": ["weather", "interior", "night", "warm"],
  "audioLayers": ["屋檐雨", "远雷", "松木火", "夜风"],
  "visualBrief": "蓝灰膜片表现雨幕与远雷，珊瑚层承担火光温度，暖灰与鼠尾草叠层形成包裹感；保持抽象材料语言，不画木屋、火焰或雨滴插画。",
  "slots": {
    "hero": { "status": "ready", "assetId": "scene.rain-cabin.hero.v1" },
    "banner": { "status": "shared-fallback", "assetId": "brand.background.banner.light-right.v1" },
    "cover": { "status": "ready", "assetId": "scene.rain-cabin.cover.v1" },
    "thumbnail": { "status": "planned", "assetId": null },
    "detail": { "status": "planned", "assetId": null }
  }
}
